{"env":{"appId":"my-app","environmentTag":"production"},"feedbackRefs":[],"links":{},"messages":[{"content":"Hello, world.","role":"user","timestamp":"2026-04-17T12:00:00.000Z"}],"model":"gpt-5.6-luna","provider":{"name":"openai"},"redactions":[],"schemaVersion":"1.0","source":{"emitter":"sdk","sdk":{"name":"autocontext-ts","version":"0.0.0"}},"timing":{"endedAt":"2026-04-17T12:00:01.250Z","latencyMs":1250,"startedAt":"2026-04-17T12:00:00.000Z"},"toolCalls":[],"traceId":"01HZ6X2K7M9A3B4C5D6E7F8G9H","usage":{"tokensIn":10,"tokensOut":15}}
